{
  "schema_version": "1.0",
  "doc_type": "deep_dive",
  "date": "2026-04-06",
  "title": "DXY Sub 100 Dollar Regime",
  "meta": {
    "generated_at": "2026-04-07T20:10:51Z",
    "tags": [
      "migrated_from_md"
    ]
  },
  "body": {
    "markdown": "# Deep Dive: DXY Sub-100 — Dollar Regime Shift? — 2026-04-06\n\n> Type: Macro Theme | Flagged by: 4 phases (forex, macro, international, commodities)\n> Trigger: Regime-level move not fully explained in the digest — DXY broke below 100 for first time this year\n> Prepared: 2026-04-06\n\n---\n\n## A. Current Setup\n\n**The Move**: DXY broke below 100 on Monday April 6, trading at 99.81-100.14. The last time DXY was comfortably below 100 was in late 2024. The break represents a -3.3% decline from the baseline of ~103.5 — a significant intraday/weekly FX move.\n\n**Immediate Driver**: Ceasefire proposal triggered risk-on USD selling (de-escalation = less safe-haven demand for USD). EUR/USD surged from ~1.080 to 1.15 (+6.5%) — the single largest catalyst (EUR is 57% of DXY weight).\n\n**But there's a deeper story** — the DXY move is not entirely explained by the ceasefire. Multiple structural forces have been pushing dollar lower:\n1. **Fed rate at 3.5-3.75%** (vs. earlier assumptions of 4.75-5.00%) — U.S. rate differential vs. EUR narrowing\n2. **De-dollarization trend** — Central bank FX reserve diversification away from USD (ongoing structural)\n3. **US current account deficit** — persistent structural USD headwind\n4. **Iran War geopolitics** — Ironically, the US engaging in another Middle East war is eroding some of the \"American exceptionalism\" premium\n\n---\n\n## B. What DXY Below 100 Means — Historical Context\n\nDXY was established in 1973 at 100. Below 100 means the USD has weakened from its baseline.\n\n**DXY Below 100 Historically**:\n- 1992-1997: Dollar weakness as US trade deficits widened; ended with Asian financial crisis\n- 2003-2008: Post-dot-com USD decline; major commodity supercycle (gold, oil, EM)\n- 2020-2023: COVID-driven dollar weakness, then recovery\n- **2024-2026**: Dollar peaked in late 2024 on aggressive Fed hikes, then declined as cuts began\n\n**Pattern in DXY sub-100 regimes**:\n- Gold consistently outperforms (commodities generally)\n- Emerging markets typically outperform US equities\n- International developed (EFA) outperforms SPY\n- Inflation tends to remain elevated (imported goods cost more for US consumers)\n\n**Current DXY context**: DXY reached lows around 100 in 2025 as the Fed began cutting, then briefly recovered to 103+ during the Iran War safe-haven demand period. The break below 100 on April 6 may be:\n- (a) A temporary spike below 100 driven by ceasefire news that reverses if escalation resumes\n- (b) The beginning of a sustained sub-100 regime as war premium fades and Fed remains on hold\n\n---\n\n## C. Technical Analysis\n\n**DXY Technicals**:\n- Current: 99.81-100.14\n- Recent range: ~98-106 (3-month)\n- Key levels:\n  - Support: 98.0 (2025 lows), 95.0 (longer-term support)\n  - Resistance: 100.5 (psychological), 102.0 (short-term), 104.0 (recent high)\n- Trend: Breakdown below 100-day and 200-day MA (estimated)\n- RSI: Likely 35-45 (oversold zone for DXY = further weakness possible short-term)\n\n**EUR/USD (most important DXY pair — 57% weight)**:\n- Was: 1.080 | Now: 1.15 (+6.5%)\n- This is a massive move — one of the largest single-week EUR/USD moves in years\n- Key levels: 1.10 (resistance just reclaimed), 1.15 (now testing), 1.20 (multi-year target)\n- If ceasefire fails: EUR/USD snapback to 1.08-1.09 (DXY rebounds to 101-103)\n- If ceasefire succeeds: EUR/USD could target 1.18-1.20 (European energy relief)\n\n**USD/JPY (second-most important — yen is 13.6% of DXY)**:\n- Current: 159.64 — ABOVE BOJ 155 intervention line\n- USD is STRENGTHENING against yen, even as DXY falls overall\n- This tells us: DXY weakness = EUR/USD surge, NOT broad USD weakness\n- USD/JPY at 160 = BOJ intervention risk\n\n---\n\n## D. Macro Context — Why Dollar Might Stay Weak\n\n### Structural Drivers of USD Weakness (Persistent)\n\n1. **Fed Rate Trajectory**: Fed at 3.5-3.75% with one more cut expected in 2026. ECB may hold or cut slower. Rate differential narrowing = EUR stronger vs USD. Institutional forecasts: DXY low-to-mid 90s by December 2026.\n\n2. **US Fiscal Deficit**: US running 6-7% of GDP deficit. Dollar funding premium may compress as supply of Treasuries increases. Foreign buyers less enthusiastic at lower real yields.\n\n3. **De-dollarization**: BRICS+ countries accelerating non-USD trade settlements (oil, commodities). Saudi Arabia accepting CNY for some oil sales. Russia/China bilateral trade in local currencies. This is slow but structural — reduces global demand for USD.\n\n4. **War Perception**: America's global standing as \"safe haven\" is being questioned when it's a party to a major regional war. Portfolio diversification away from USD-denominated assets is accelerating among sovereign wealth funds.\n\n### Cyclical Driver (Temporary)\n\n5. **Iran Ceasefire De-escalation**: The immediate catalyst. If ceasefire fails, USD recovers 2-3% within days. If ceasefire succeeds, USD may consolidate sub-100 but not fall dramatically further (war premium = both ways).\n\n### The Tension\n\nThe ceasefire scenario = DXY stays weak (risk-on, less safe haven demand), but also = growth recovery = risk-on assets rise = some demand for USD returns. Net: DXY stays in 98-103 range.\n\nThe escalation scenario = DXY recovers to 101-104 on safe-haven demand, but then resumes decline as Fed cuts eventually and fiscal deficit widens.\n\n**Long-term view**: DXY is likely in a gradual secular decline from 2025 highs toward 90-95 range by 2027 regardless of ceasefire outcome. The war just interrupted and temporarily reversed this trend.\n\n---\n\n## E. Portfolio Implications of Sustained DXY Weakness\n\n### Direct Effects on Current Holdings (CAD-denominated investor)\n\nThe investor is Canadian (home currency: CAD). USD holdings in a weaker USD environment face FX headwinds when converted back to CAD.\n\n| Holding | USD Impact | CAD Impact | Net |\n|---------|-----------|-----------|-----|\n| BIL (40%) | Stable USD price | FX headwind if USD/CAD falls | ~neutral (USD/CAD at 1.39, minimal move) |\n| IAU (20%) | Gold UP on DXY weakness | Double positive: gold + USD/CAD | ✅ Positive net |\n| SHY (15%) | Stable | FX headwind if USD weakens | Slight negative |\n| XLE (12%) | Oil price in USD; XLE in USD | FX neutral to negative | Mixed |\n| XLP (8%) | Stable | FX neutral | Neutral |\n| DBO (5%) | Oil in USD | FX neutral | Neutral |\n\n**Key insight**: IAU is the best position in a USD weakness regime — gold is priced in USD (rises as USD falls) AND the CAD investor gains on both the gold price AND the USD amount converting back (if USD/CAD is stable or rising). IAU is a double tailwind position.\n\n### Strategic Implications of DXY Sub-100 Regime\n\nIf DXY stays below 100 for an extended period (which institutional forecasts suggest), the following assets gain relative attractiveness vs. current portfolio:\n\n1. **Gold (IAU)**: ✅ Already held. Best performing in USD weakness.\n2. **International Equity (EFA, EEM)**: Not held. Would outperform US equities in sustained USD weakness. Consider post-Tuesday resolution.\n3. **Commodities (PDBC, DJP)**: DXY weakness = commodity price inflation in USD. Oil, copper, agricultureall benefit. DBO (held) benefits.\n4. **TIPS (TIP)**: USD weakness = inflation = TIPS outperform nominal bonds. Not held — consider if CPI Thursday > 4%.\n5. **Emerging Markets (EEM, VWO)**: EM equity outperforms in USD weakness. Current AVOID stance due to binary event; review post-Tuesday.\n\n**Assets that UNDERPERFORM in USD weakness**:\n- US short-duration bonds (BIL, SHY): Earn in USD; FX headwind for CAD investor. Still best cash proxy but yield erodes in CAD terms.\n- USD cash generally.\n\n---\n\n## F. Risk to the Thesis (DXY Stays Weak)\n\n**Bull case for DXY recovery**:\n1. Escalation confirmed → safe-haven USD buying → DXY to 102-104\n2. CPI Thursday > 4% → Fed signals no more cuts → USD strengthens on rate differential\n3. BOJ intervention fails → yen continues weakening → USD/JPY at 162+ → DXY may stabilize even as EUR rises\n\n**Bear case (DXY continues falling)**:\n1. Ceasefire signed → risk-on → DXY toward 97-98\n2. Fed signals May cut → rate differential collapses → EUR/USD to 1.18+\n3. Fiscal deficit concerns escalate → USD confidence crisis (low probability, high impact)\n\n---\n\n## G. Summary\n\n**The Bottom Line**: DXY breaking below 100 is both a ceasefire-driven cyclical signal AND the emergence of structural dollar weakness. Even in an escalation scenario, DXY likely stays in the 100-104 range (not returning to 106+ unless aggressive Fed reversal or new safe-haven demand spike).\n\n**For the portfolio**: IAU is already the optimal expression of USD weakness. The primary upgrade from here (post-Tuesday) would be adding international equity exposure (EFA/VGK) or TIPS if CPI is hot. For the CAD investor, sustained DXY weakness is a net negative on USD-denominated cash (BIL/SHY) but a net positive on gold (IAU) and commodities (DBO) — which is why the current barbell is broadly correct for this regime.\n\n**Key level to watch**: DXY 98.0 (2025 support). If DXY breaks below 98, it signals a structural shift — not just a ceasefire spike — and would warrant rotating 5% of BIL/SHY into IAU or PDBC.\n\n---\n\n*Deep dive prepared: 2026-04-06*\n*Subject: DXY Sub-100 — Dollar Regime Shift*\n*Triggered by: Regime-level FX move not fully explained in digest; cross-phase signal in forex, macro, international, commodities*\n",
    "sections": [
      {
        "heading": "Deep Dive: DXY Sub-100 — Dollar Regime Shift? — 2026-04-06",
        "level": 1
      },
      {
        "heading": "A. Current Setup",
        "level": 2
      },
      {
        "heading": "B. What DXY Below 100 Means — Historical Context",